question,answer,intent
여기는 오픈한 지가 얼마 됐어요?,2년 됐어요,영업기간문의
여기는 오픈하신지 얼마쯤 되셨어요?,5년 넘었어요,영업기간문의
여기 생긴 지 얼마나 됐어요?,한 이삼 년 된 것으로 알고 있어요,영업기간문의
가게가 몇 년 정도 됐어요?,이 건물 지을 때부터 있었어요,영업기간문의
가게 오픈하신지 얼마나 되셨어요?,삼 년 넘었어요,영업기간문의
문 여신지 오래되셨어 예?,3년이요,영업기간문의
여기는 오픈한지 오래됐어요?,그건 잘 모르겠습니다,영업기간문의
여기 생긴 지 오래됐어요?,1년 좀 넘었어요,영업기간문의
여기는 언제 생겼어요?,오래됐는데요,영업기간문의
여기 생긴지 얼마나 됐어요?,두 달 정도 됐어요,영업기간문의
오픈한 지 얼마나 됐습니까?,저희 칠월에 했습니다,영업기간문의
여기가 새로 생긴 매장이에요?,저희가 작년 오뉴월쯤에 생겼을 거예요,영업기간문의
여기 오픈하신 지 얼마쯤 되셨어요?,오래 했어요 십 년이 넘어요,영업기간문의
여기서 하신지 오래되셨어요?,한 육 개월 정도 됐어요,영업기간문의
음식이 깔끔하고 괜찮은데 엄청 오래되셨나 봐요 음식 하신지가?,12년 됐어요,영업기간문의
언제부터 하셨어요?,20년 넘었지요,영업기간문의
여기 가게 이거 하신지 얼마 안 되셨죠?,1년요,영업기간문의
영업하신지가 얼마쯤 되셨어요?,지금 4년 정도 됐어요,영업기간문의
오픈하신지는 얼마 되셨는데요?,우리 한 23년 됐어요,영업기간문의
여기는 언제부터 영업하셨어요?,그건 잘 모르겠어요,영업기간문의
여기 언제부터 장사했어요?,저희 이년 됐습니다,영업기간문의
본죽은 저쪽에도 매장이 있던데 여기는 생긴지 얼마 안 됐죠?,여기는 일 년 육 개월 정도 됐어요,영업기간문의
그럼 여기서 하신지는 얼마나 되셨는데요?,여기 온 지는 몇 개월 안됐어요,영업기간문의
여기 하신 지 얼마나 되셨는데요?,저 밑에서 십 년 하다가 저기 집이 헐린다고 해가지고 올라왔어요,영업기간문의
생긴지 얼마 안 됐죠?,생긴지 좀 된 걸로 알고 있어요,영업기간문의
여기 개정이 언제 생겼어요?,저희가 이월 일일부터 생겼습니다,영업기간문의
하신지 오래되셨죠?,네 오래됐어요,영업기간문의
여기는 오픈한지 몇 년쯤 되셨어요?,한 이년 넘었어요,영업기간문의
이 가게 여기 오픈하신지 얼마 되셨어요?,일 년 넘었어요,영업기간문의
여기 가게 오픈한지 몇 년쯤 되셨어요?,구 년이요,영업기간문의
여기 생긴지는 얼마나 됐어요? 오래됐죠? 몇 년쯤 됐어요?,한 5년 됐어요,영업기간문의
오래됐어요 여기?,저희 70년 됐어요,영업기간문의
반전하신지 오래되셨어요?,한 25년 됐어요,영업기간문의
장사하신지가 오래되셨어요?,한 7년 넘었어요,영업기간문의
오픈한 지가 오래됐어요?,얼마 전에 주인이 바뀌었어요,영업기간문의
짬뽕집 생긴 지가 얼마쯤 됐어요?,좀 오래됐어요,영업기간문의
여기 오픈한지 오래됐어요?,네 5년 넘었어요,영업기간문의
오픈한 지가 몇 년쯤 되셨죠?,한 20년 됐어요,영업기간문의
오픈하신지 오래되셨죠?,한 40년 다 돼가요,영업기간문의
여기서 하신지 오래되셨죠?,한 육십 년 됐어요,영업기간문의
여기는 생긴지 오래됐죠?,한 이십 년 됐어요,영업기간문의
여기서 장사하신지 오래되셨어요?,오픈한지는 얼마 안 됐어요,영업기간문의
가게 오픈한 지 얼마쯤 되셨어요?,거의 이십 년 다 돼가죠,영업기간문의
오픈하신지 얼마 되셨어요?,여기서는 얼마 안 돼요,영업기간문의
가게 하신지는 오래되셨어요?,저희 2년 넘었어요,영업기간문의
영업하신지 얼마나 되셨어요?,40년 됐어요,영업기간문의
생긴지는 오래됐습니까?,좀 오래됐습니다,영업기간문의
예 이거 생긴지 얼마 안 됐죠?,제가 이 동네에서 십 년째 하고 있어요,영업기간문의
여기 오픈하신지 얼마 되셨어요?,일 년 정도 됐습니다 1년 아직 안 되고 5월에 오픈했어요,영업기간문의
여기는 생긴 지 오래됐어요?,몇 년 안됐어요,영업기간문의
몇 시부터 몇 시까지 배달돼요?,아마 열한시부터 열한시까지요,영업기간문의
여기가 생긴지 얼마나 됐어요?,일 년 반 정도 되었네요,영업기간문의
여기서 만두 만드신지 오래되었죠?,네,영업기간문의
오픈하신지 얼마 되셨어요?,육 년 됐죠,영업기간문의
여기 가게 오픈하신지 얼마 안 되셨죠?,오 년 넘었어요,영업기간문의
얼마쯤 하셨어요?,사 년 다 돼가지고요,영업기간문의
하신지 오래됐어요?,저는 육 년이고 앞사람은 사 년 되었어요,영업기간문의
여기 오픈한지 오래되셨어요?,삼 년째에요,영업기간문의
여기는 영업하신지가 오래됐어요 문 연 지가?,심한 삼사 년 정도 됐어요,영업기간문의
여기는 오픈한지 오래됐어요?,네 오래됐어요,영업기간문의
김밥 집 생긴지 오래됐어요?,십 년 넘었어요,영업기간문의
여기 오픈한지 오래되셨죠? 얼마 되셨어요?,오래됐어요,영업기간문의
오늘 오후 영업 몇 시부터인가요,5시부터입니다,영업시간문의
저녁식사 가능한가요?,네 가능합니다,영업시간문의
여기 24시간 하시는가 예?,네,영업시간문의
배달은 몇 시까지 해요?,배달은 9시까지 해요,영업시간문의
몇 시부터 몇 시까지 하시는 거예요?,10시에 열어서 개강하면 10시까지 해요 주말에는 9시 반까지 합니다,영업시간문의
여기 24시간 영업해요?,네,영업시간문의
여기는 몇 시부터 몇 시까지 문 열어놔 예?,저희 12시 오픈해서 10시에 닫아요,영업시간문의
그래요 몇 시부터 몇 시까지 열어놔 예?,오픈은 열시 반에서 열한시쯤에 하고 마지막 주문은 9시 반까지 받아요,영업시간문의
몇 시부터 몇 시까지 하시는데 예?,6시부터 10시까지요 낮에는 12시부터 3시까지 해요,영업시간문의
몇 시에서 몇 시까지 영업하세요?,저희 총 11시 반부터 새벽 2시까지 영업합니다,영업시간문의
몇 시부터 몇 시까지 하세요?,저희 열시 반부터 열시까지 해요,영업시간문의
여기 문은 몇 시부터 몇 시까지 열어요?,열한시부터 아홉시까지요,영업시간문의
몇 시부터 몇 시까지 영업하세요?,열한시부터 여덟시 반까지 해요,영업시간문의
여기는 몇 시부터 몇 시까지 열어놔 예?,10시 반부터 거의 8시 반까지요,영업시간문의
몇 시부터 몇 시까지 하는데요?,11시부터 11시까지예요,영업시간문의
여기 몇 시에서 몇 시까지 하세요?,10시부터 9시까지요,영업시간문의
여기 몇 시에서 몇 시까지 하세요?,10시 20분 시작 저녁 8시 마감해요,영업시간문의
점심때는 몇 시부터 시작하세요?,한 11시부터요,영업시간문의
몇 시부터 몇 시까지 하시는데 예?,저녁에는 주방 마감이 8시 반입니다,영업시간문의
점심때는 예?,시작은 11시오,영업시간문의
몇 시까지 해요?,오픈은 11시 반이고 마감은 9시 20분까지 해요,영업시간문의
점심시간은 지났죠?,네 지났어요,영업시간문의
식사 됩니까?,다 됩니다,영업시간문의
식사 됩니까?,네 앉으세요,영업시간문의
식사 되나요?,네,영업시간문의
지금 식사돼요?,네,영업시간문의
보통 몇 시까지 하세요?,아홉시 정도쯤에 마감 시작해요,영업시간문의
영업시간이 언제부턴 데예?,열한 시부터 두시 반까지 하거든요,영업시간문의
지금 식사 돼요?,십분 전이 어서 되긴 돼요,영업시간문의
지금 가면 먹을 수 있나요?,열한 시에 오세요,영업시간문의
식사 되나요?,네,영업시간문의
지금 요리돼요?,네,영업시간문의
"점심, 저녁 돼요?",네,영업시간문의
정말 빨리 나오네요 여기는 문을 몇 시부터 몇 시까지 열어요?,문을 세시 반쯤 열어서 점심 저녁 팔고 한 여덟시 되면 문 닫아요,영업시간문의
여기는 몇 시부터 몇 시까지 문 열어요?,아홉시부터 아홉시까지고 아침 식사는 열한시 반 돼야 돼요,영업시간문의
예예 몇 시부터 몇 시까지 하시는데요?,일찍 올 때는 여섯시 일곱시고 아침밥은 못해도 점심은 꼭 해요,영업시간문의
가게 문은 항상 열려있던데 몇 시부터 몇 시까지예요?,열한시부터 밤 열한시까지요,영업시간문의
여기는 몇 시에서 몇 시까지 해요?,열한시 반 오픈해서 아홉시 반 까지고 주문 마감은 아홉시에요,영업시간문의
오후에는 잘 안 계시죠?,"네 보통 세시 반, 네시까지 있어요",영업시간문의
여기 예전에 이십사 시간 아니었어요?,네 그랬는데 바꿨어요,영업시간문의
점심때도 장사하나요?,열한시 반에 해요,영업시간문의
밥 먹을 수 있죠?,네,영업시간문의
영업 안 하세요?,장사합니다,영업시간문의
점심 돼요?,네 이쪽으로 앉으세요,영업시간문의
몇 시부터 몇 시까지 열어놔요?,아침 열한시 반 오픈해서 저녁 일곱 시에 문 닫아요,영업시간문의
식사 가능해요?,네,영업시간문의
식사 돼요?,네네,영업시간문의
여기 몇 시부터 몇 시까지 열어놔요?,열한시부터 열아홉시에 닫아요,영업시간문의
몇 시에서 몇 시까지 하세요?,9시부터 밤 9시 반까지요,영업시간문의
평일날 몇 시부터 몇 시까지 하시는데요?,아침 열한 시부터 여덟 시까지 해요,영업시간문의
식사 가능해요?,네 됩니다,영업시간문의
몇 시부터 몇 시까지 해요?,열한 시부터 저녁 여덟시 반까지 해요,영업시간문의
영업을 몇 시부터 몇 시까지 해요?,열 시부터 열두 시까지 해요,영업시간문의
영업은 몇 시부터 몇 시까지 해요?,열 시부터 아홉 시까지 해요,영업시간문의
몇 시부터 몇 시까지 열어요?,열한 시부터 아홉 시까지요,영업시간문의
문은 몇 시부터 몇 시까지 열어놔요?,시작은 보통 열한 시부터 저녁은 여덟시 반 정도요,영업시간문의
여기는 몇 시부터 몇 시까지 영업해요?,저희 열한 시부터 아홉 시까지 해요,영업시간문의
저번에 오니까 휴무던데 몇 시부터 몇 시까지 하세요?,월요일 날은 저희가 휴무고요 저녁에는 한 아홉 시까지 있는데 마지막 주문은 여덟시 반까지 해요,영업시간문의
그렇죠 그럼 몇 시부터 몇 시까지 하세요?,저희 열두 시부터 저녁 열 시까지 해요,영업시간문의
네 여기 몇 시부터 몇 시까지 해요?,저희 오픈은 한 열한 시 사십 분부터 하고요 손님 없으면 열 시쯤 마감하고요,영업시간문의
영업시간은요?,마지막 손님은 오후 여덟시 반까지요,영업시간문의
점심도 하시고?,네,영업시간문의
몇 시부터 몇 시까지 하는데요?,다음 주부터는 점심 장사해서요 열두 시 오픈하고 열두 시까지요,영업시간문의
식사 가능해요?,예 식사 가능해요,영업시간문의
혹시 지금 식사 돼요?,네,영업시간문의
여기 저녁에는 몇 시까지 해요?,여덟시 반까지 주문받고 아홉시 반까지 열어요,영업시간문의
지금 식사돼요?,네,영업시간문의
영업은 몇 시부터 몇 시까지 하세요?,저희 매주 일요일은 쉬고요 아침 일곱시 반부터 마지막 주문은 여덟시 반까지 해요,영업시간문의
몇 시부터 몇 시까지 문 열어요?,아홉시 반에서 아홉시 반까지예요,영업시간문의
몇 시부터 몇 시까지 영업해요?,여덟시부터 여덟 시요 아침에는 여덟시 반쯤 돼야 김밥 돼요,영업시간문의
몇 시부터 몇 시까지 열어요?,혼자 하기 때문에 시간은 없어요,영업시간문의
몇 시부터 몇 시까지 문 열어요?,일곱시부터 아홉시 반까지요,영업시간문의
문은 몇 시부터 몇 시까지 열어요?,24시간이요,영업시간문의
거기 영업시간이 어떻게 돼요?,아침 열시 반부터 여덟 시까지 해요,영업시간문의
저 메뉴가 이름이 뭐예요?,치킨덮밥이에요,옆테이블에서먹는음식이름질문
옆에 드시는 건 어떤 거?,꽃게 된장찌개입니다,옆테이블에서먹는음식이름질문
저건 뭐예요? 맛있어 보이는데,커플세트 하시고 4천 원 추가하시면 이걸로 변경 가능하세요 보통 두 분 오시면 저렇게 많이 드세요,옆테이블에서먹는음식이름질문
옆 테이블에서 드시는 메뉴는 뭐예요?,장어초밥입니다,옆테이블에서먹는음식이름질문
옆에 시킨 건 뭐죠?,참치랑 새우 시키셨어요,옆테이블에서먹는음식이름질문
몇 명까지 할 수 있어요?,팔십 명이요,예약가능인원문의
대부분 코스요리로 하나요? 개별 요리로 하나요?,우리 매장은 양으로 따지면 코스가 쌉니다.,예약메뉴문의
메뉴는 이거 보면 3~4인분 있네요?,주로 예약하시면 이런 거 드세요 인당 25000원 정도 생각하시면 돼요,예약메뉴문의
메뉴도 예약을 해야 돼요?,메뉴는 오셔서 바로 정해도 되고요,예약메뉴문의
저녁에는 그냥 메뉴는 안돼요?,아니요 찌개 같은 거 드셔도 되는데 저녁에는 거의 생오리 삼겹살 같은 메뉴들이 예약이 많아요,예약메뉴문의
그러면 대량 주문 넣으면 가능하겠다 그죠?,네,예약메뉴문의
그 양은 얼마 정도 있어야 돼요?,한 이십 인분은 되어야지요,예약메뉴문의
그러면 한 여섯 시나 여섯시 반쯤 돼가지고 주문을 넣으면 그때 가능한가요?,가능은 한데 양이 조금 있어야 가능하지요,예약메뉴문의
김밥은 혹시 예약이 가능한가요?,네 예약 가능해요,예약메뉴문의
그러면 삼십 줄 이렇게 해서 주문하면 언제쯤 전화드려야 돼요?,어 만약에 아침 일찍 필요하시면 하루 전 날 말씀해 주시면 되고요,예약메뉴문의
혹시 그러면 김밥 따로 주문하려고 하면 언제 말해줘야 돼요?,낮에요 하루 전에 이야기해주면 좋고요,예약메뉴문의
그럼 그걸로 예약해주세요,네 곧 예약 확인 문자 발송해드리겠습니다,예약문의
다음 주 26일 수요일에 예약하고 싶습니다,그날 예약 가능합니다,예약문의
미리 예약이 가능한가요?,네 가능하십니다,예약문의
오늘 저녁에 2명 예약할 수 있나요?,네 오늘 저녁 예약됩니다,예약문의
그럼 그 시간으로 8명 예약해주세요,네 알겠습니다,예약문의
그럼 내일 저녁 7시 괜찮을까요?,7시 30분이 더 괜찮습니다,예약문의
예약 가능한가요?,네 가능합니다,예약문의
5시 가능할까요?,네 5시로 예약 잡아드리겠습니다,예약문의
12시에 3명 예약하려고 하는데요,네 가능합니다만 조금 기다리셔야 할 수도 있어요,예약문의
그럼 지금 예약 가능한가요?,네 가능하세요,예약문의
아까 예약하고 온 사람입니다,네 이쪽에 앉으세요,예약문의
토요일 저녁 7시 가능한가요?,네 가능합니다,예약문의
내일 예약 가능한가요?,모레부터 가능합니다,예약문의
메뉴도 미리 주문해야 하나요,메인 요리는 미리 주문하시면 좋습니다,예약문의
예약 명수는 당일에 바꿔도 괜찮은가요?,네 물론입니다,예약문의
다음 주 주말에 예약 가능한가요?,다음 주 일요일은 가능합니다,예약문의
지금 4명 예약하려고 하는데 자리 있나요?,네 자리 있습니다,예약문의
언제 예약하면 되나요?,최소 하루 전에 예약하시면 됩니다,예약문의
5시에 3명 예약해주세요,네 알겠습니다,예약문의
5월 27일 4시 예약할 수 있나요?,네 가능합니다,예약문의
음식도 미리 주문해둘 수 있죠?,네 여기 메뉴 보시고 주문하시면 됩니다,예약문의
이번 주 일요일 오후에 예약 가능한가요?,네 가능합니다,예약문의
혹시 예약을 취소하게 되면 어떻게 해야 하나요?,최소 하루 전에 전화로 알려주세요,예약문의
음식도 미리 전화로 주문해야 하나요?,아니요 음식은 오셔서 주문해야 합니다,예약문의
이번 주 일요일 12시 4명 예약 가능한가요?,네 가능합니다,예약문의
이번 주 일요일 12시에 4명 예약 가능한가요?,네 가능합니다,예약문의
4명이고 메뉴도 미리 주문해야 하나요?,오셔서 주문하셔도 됩니다,예약문의
예약 가능한가요?,네 가능합니다,예약문의
주문은 가서 해도 되지 않나요?,네 그러셔도 됩니다,예약문의
7시에 예약 가능한가요,네 가능하십니다,예약문의
이번 주 토요일 10명 룸으로 예약하고 싶은데 가능한가요?,네 가능하십니다,예약문의
저녁 7시에 예약 가능한가요,네 가능합니다,예약문의
인원은 몇 명까지 예약 가능한가요,룸으로 예약 시 10명까지 가능합니다,예약문의
오늘 저녁에 예약 가능한가요,네 가능합니다,예약문의
다음 주 금요일로 예약해주세요,예약되었습니다,예약문의
아까 예약한 김 모 씨입니다,아 네 이쪽으로 오세요,예약문의
다음 주 금요일 디너타임에 가려고 합니다 괜찮을까요,네  가능하세요,예약문의
오늘 16명 자리를 예약할 수 있나요?,네 예약 가능합니다,예약문의
혹시 내일 저녁 여섯시에 식사 예약 가능한가요?,"네 가능합니다. 예약자분 성함, 연락처, 인원수를 남겨주세요",예약문의
12시에 바로 식사할 수 있게 준비해주세요,네 알겠습니다,예약문의
2월 14일 오후 12시에 가능한가요?,네 가능합니다,예약문의
그럼 그렇게 예약해주세요,네 오후 6시 4분 예약해 드렸습니다,예약문의
오늘 예약 가능한가요?,네 가능합니다,예약문의
내일 가려고 하는데 전화로 예약 가능한가요?,네 가능합니다,예약문의
혹시 예약되나요?,네 가능합니다,예약문의
일반 김밥 하게 요 저희 산에 놀러 가는데 언제쯤 주문하면 돼요?,하루 전날 주문하시면 돼요,예약문의
저희 단체 주문 나중에 하려면 언제쯤 전화드려야 돼요?,그 전날 전화해 주시면 돼요,예약문의
저녁에 예약되는가 예?,저녁 예약은 가능하고 낮에는 안됩니다.,예약문의
그 면 당일에 예약해야 돼요?,아니요 그 전날 얘기해야 돼요,예약문의
10인분 정도 주문은 가능하나요?,네 미리 전화 안 하면 못 해드리지요,예약문의
그럼 저녁에 예약 할라 카면 하루 전에 전화해도 돼요?,네,예약문의
여기 예약되는가요?,네,예약문의
여기 룸도 있어요? 예약하려는데,룸은 2층에도 있고 1층에도 의자 붙여서 앉을 수 있습니다,예약문의
5명 정도 예약하려면 언제 해야 하나요?,오시기 30분 전에만 전화 주시면 돼요,예약문의
예약 이런 거는?,됩니다,예약문의
"그럼 내가 한 세 개, 네 개 하려면 미리 전화 좀 해놔도 되는 거죠?",네 미리 전화하시면 저희가 만들어 드려요,예약문의
예약 안 해도 올 수 있어요?,예약하시는 게 좋죠,예약문의
시간 언제쯤 전화드리면 되죠?,편하실 때 전화하시면 됩니다,예약문의
여기 예약도 되는가요?,네,예약문의
혹시 여기 모임 하면 예약 몇 명까지 가능해요?,최대 16명이요,예약문의
미리 예약 잡으면 되죠?,네 미리 예약하시면 편하죠,예약문의
예약 할라 카면 얼마 전에 연락드려야 되예?,하루 전에만 연락하시면 돼요,예약문의
예약은 며칠 전에 해야 하는가요?,만약에 저녁에 오실 거면 당일 2시간 전까지는 연락 주시면 돼요,예약문의
만약에 요리 주문하려면 언제쯤 연락을 드려야 되는 거예요?,음식이 빨리 나오는 편인데 종류가 많고 바쁜 시간이면 시간이 조금 걸릴 수가 있어요,예약문의
예약할라 카는데 예 혹시 거기 방이 있습니까?,네 방 있습니다,예약문의
예약하려면 언제쯤 전화드려야 되예?,오시기 한 3~40분 전에 주시면 돼요,예약문의
한 5~6명 예약하고 그럴라 카면은 자리 괜찮은가 예?,그 정도는 홀에 넉넉합니다,예약문의
예약을 미리 해야 돼요?,방이 몇 개 없어서 좀 일찍 예약하시면 좋죠,예약문의
여기 예약 가능해요?,예,예약문의
여기 계 추하려면 미리 전화를 걸고 해야 돼요?,아뇨 상관없어요,예약문의
한 열 명쯤 내일이나 모레 계 추하려면 미리 예약하고 와야 되죠?,네,예약문의
며칠 전에 예약을 해야 돼요?,하루 전이라도 예약하시면 되는데 예약이 많아서 방을 하시려면 미리 예약하시면 좀 낫죠,예약문의
한 열 명 계초할려면 미리 전화드리면 되나요?,네 미리 주시면 오히려 낫겠죠?,예약문의
낮에는 둘 세 명쯤 오면 미리 예약하면 되겠다 그죠?,네 예약하셔도 되고 열시 이후에는 직원들이 다 있어서 괜찮아요,예약문의
계 추하려면 미리 연락을 해야 돼요?,평일에는 예약 없이 이용 가능하시고요 주말에는 행사가 있어서 예약하셔야 해요,예약문의
김밥 이삼십 줄 정도 주문하려면 그 전날 주문해야 돼요?,네,예약문의
몇 개부터요?,한 스무 개는 돼야 해요,예약문의
예약 같은 거는?,네 해드리죠,예약문의
예약 좀 하려 해서,예약하시면 시간은 맞춰 드려요,예약문의
보통 몇 시쯤에 주문하면 돼요?,오픈은 여덟시 반에 하고 주말엔 여덟시에 하고 저녁에는 열시까지 해요,예약문의
김밥 단체 주문 같은 거 받아요?,네,예약문의
여기 예약 같은 거도 돼요?,예약은 따로 안 받아요,예약문의
우리는 여기 근처인데 계모임 같은 거 할 수 있나 해서요,네,예약문의
그러면 주문할 때는 언제 전화드려야 돼요?,하루 전에요,예약문의
그러면 예약하려면 며칠 전쯤에 전화해야 돼요?,한 3 4일 전쯤에 하셔야 해요,예약문의
계추 하기 전에는 미리 전화를 해야 되나요?,네 예약하시고 오셔야 돼요,예약문의
여기는 단체 예약 같은 것도 받나요?,저희 룸 있어요,예약문의
며칠 전에 전화드려야 되죠 모임 하려면?,그렇죠 준비할 시간도 있어야 되니까 여성분들 모임 하려면 방이 있어야 되더라고요,예약문의
그러면 일 인당 얼마 이렇게 들어요 아니면 와서 그냥 요리 시켜요?,그냥 메뉴판 보시고 시키면 돼요,예약문의
주말에 예약하고 와야 되나요?,네 주말은 예약하고 오셔야 해요,예약문의
그 전전날 연락 주면 돼요?,네 일찍 말씀해주시면 좋죠,예약문의
계추 하면 미리 연락하고 와야 해요?,네 미리 연락 주세요,예약문의
여기는 계 추하러 오면 미리 말씀드리고 와야 해요?,네,예약문의
네 명은 예약할 필요는 없죠?,예,예약문의
몇 명까지 받을 수 있어요?,스무 명까지요,예약문의
여기 단체도 예약받아요?,네,예약문의
몇 명까지? 열 명 열두 명 정도,가능하죠,예약문의
저녁에 예약도 가능한가요?,가능합니다,예약문의
며칠 전에 전화해야 하나요?,하루 전에 전화 주시면 돼요,예약문의
여기 예약도 돼요? 모임 같은 거?,예,예약문의
전날 전화드려야 하죠?,네,예약문의
모임 받기는 받아요? 몇인까지 받아요?,네 한 스무 명까지요,예약문의
모임 하면 며칠 전에 전화해야 해요?,하루 전에 해도 돼요,예약문의
여기서 모임도 해요?,네,예약문의
그 모임은 전날 전화드려야 하나요 오전에 전화드리고 오후에 와도 돼요?,예,예약문의
여기 모임을 받나요?,네,예약문의
동태탕 이런 거 하려면 예약해야 해요?,예약 안 해도 됩니다 포장도 되고요 동태탕 되게 맛있어요,예약문의
며칠 전에 전화하고 와야 되죠?,전날이나 아침 한 아홉시 반 이후에 전화 주시면 돼요,예약문의
한 열 명 정도 회식하면 미리 연락해야 되죠?,네 예약을 하셔야 돼요,예약문의
예약 없이 그냥 와도 되나요?,네 그냥 오셔도 돼요,예약문의
모임 예약하려면 며칠 전에 하면 되나요?,하루 전에 연락 주시면 돼요,예약문의
그럼 미리 전화를 해야 되겠네요? 며칠 전에?,네 그래야죠 저희가 원래 아침 일찍 그렇게 준비를 안 하기 때문에요,예약문의
여기 혹시 단체로 주문할 수 있나요?,네 가능해요,예약문의
방은 예약해야 하죠?,네 예약하셔야 해요,예약문의
만약에 배달하게 되면 몇 시쯤 전화드려야 되나요?,메뉴 준비하는데 시간이 걸리니까 두세 시간 전에 말씀해 주시면 좋죠,예약문의
